{
  "$schema": "https://json-schema.org/draft/2020-12/schema",
  "$id": "https://afn.local/schemas/route.schema.json",
  "title": "AFN 学习路线数据结构",
  "description": "对应 data/route/*.json。依据架构书 四(二) Web 入口「路线图采用有向图形式表达知识点依赖顺序」。",
  "type": "object",
  "required": ["schema_version", "route_id", "topic", "generated_at", "stages", "edges"],
  "additionalProperties": false,
  "properties": {
    "schema_version": {
      "type": "string",
      "pattern": "^\\d+\\.\\d+$",
      "description": "Schema 契约版本，破坏性变更时递增主版本号"
    },
    "route_id": {
      "type": "string",
      "pattern": "^route-[a-z0-9-]+$",
      "description": "路线唯一标识"
    },
    "topic": {
      "type": "string",
      "minLength": 1,
      "maxLength": 60,
      "description": "科研方向 / 学习主题"
    },
    "generated_at": {
      "type": "string",
      "pattern": "^\\d{4}-\\d{2}-\\d{2}T\\d{2}:\\d{2}:\\d{2}\\+08:00$",
      "description": "生成时间，ISO 8601 带 UTC+8 时区"
    },
    "generated_by": {
      "type": "string",
      "pattern": "^[a-z0-9-]+@v\\d+\\.\\d+$",
      "description": "生成来源：<skill-name>@v<版本>，用于数据溯源"
    },
    "user_profile_ref": {
      "type": "string",
      "description": "关联的用户画像标识（脱敏）"
    },
    "stages": {
      "type": "array",
      "minItems": 1,
      "description": "分阶段路线，对应架构书「前置基础 → 经典论文 → 开源库 → 开放挑战」",
      "items": {
        "type": "object",
        "required": ["stage_id", "name", "order", "knowledge_points"],
        "additionalProperties": false,
        "properties": {
          "stage_id": {
            "type": "string",
            "pattern": "^stage-\\d{2}$"
          },
          "name": {
            "type": "string",
            "minLength": 1,
            "maxLength": 30
          },
          "order": {
            "type": "integer",
            "minimum": 1
          },
          "estimated_weeks": {
            "type": "number",
            "minimum": 0
          },
          "knowledge_points": {
            "type": "array",
            "items": {
              "$ref": "#/$defs/knowledge_point"
            }
          }
        }
      }
    },
    "edges": {
      "type": "array",
      "description": "知识点依赖的有向边，Web 侧据此绘制有向图",
      "items": {
        "type": "object",
        "required": ["from", "to", "relation"],
        "additionalProperties": false,
        "properties": {
          "from": {
            "type": "string",
            "pattern": "^kn-\\d{4}$"
          },
          "to": {
            "type": "string",
            "pattern": "^kn-\\d{4}$"
          },
          "relation": {
            "type": "string",
            "enum": ["prerequisite_of", "related_to", "extends"]
          }
        }
      }
    }
  },
  "$defs": {
    "source": {
      "type": "object",
      "description": "出处标注。架构书六(二)合规硬性要求：所有学术内容附来源。",
      "required": ["type", "title", "url"],
      "additionalProperties": false,
      "properties": {
        "type": {
          "type": "string",
          "enum": ["paper", "textbook", "survey", "course", "repo", "doc"]
        },
        "title": {
          "type": "string",
          "minLength": 1,
          "description": "原始标题，保留原语言不翻译"
        },
        "authors": {
          "type": "array",
          "items": { "type": "string" }
        },
        "url": {
          "type": "string",
          "format": "uri",
          "pattern": "^https?://",
          "description": "必须为可公开访问的链接，对应语料准入标准"
        },
        "published_date": {
          "type": "string",
          "pattern": "^\\d{4}-\\d{2}-\\d{2}$"
        }
      }
    },
    "knowledge_point": {
      "type": "object",
      "required": ["kp_id", "name", "level", "status", "source"],
      "additionalProperties": false,
      "properties": {
        "kp_id": {
          "type": "string",
          "pattern": "^kn-\\d{4}$",
          "description": "知识点标识，与 knowledge/domains 中知识单元的 id 对应"
        },
        "name": {
          "type": "string",
          "minLength": 1,
          "maxLength": 60
        },
        "level": {
          "type": "string",
          "enum": ["入门", "经典", "前沿"]
        },
        "status": {
          "type": "string",
          "enum": ["not_started", "in_progress", "completed"],
          "description": "用户在该知识点上的进度状态"
        },
        "prerequisites": {
          "type": "array",
          "items": {
            "type": "string",
            "pattern": "^kn-\\d{4}$"
          }
        },
        "source": {
          "$ref": "#/$defs/source"
        }
      }
    }
  }
}
